{
  "entries": [
    {
      "decisions": [
        {
          "dimension": "scope-boundary",
          "status": "pending"
        },
        {
          "dimension": "material-omissions",
          "status": "pending"
        },
        {
          "dimension": "aggregation-split-quality",
          "status": "pending"
        },
        {
          "dimension": "multi-region-membership",
          "status": "pending"
        },
        {
          "dimension": "mathematical-correctness",
          "status": "pending"
        },
        {
          "dimension": "capability-observability",
          "status": "pending"
        },
        {
          "dimension": "representation-coverage",
          "status": "pending"
        },
        {
          "dimension": "dependency-state-honesty",
          "status": "pending"
        }
      ],
      "overall_status": "pending",
      "territory_id": "ola:n:c686a2f1-9583-463c-b33c-219822a370a9",
      "territory_revision": 1
    },
    {
      "decisions": [
        {
          "dimension": "scope-boundary",
          "status": "pending"
        },
        {
          "dimension": "material-omissions",
          "status": "pending"
        },
        {
          "dimension": "aggregation-split-quality",
          "status": "pending"
        },
        {
          "dimension": "multi-region-membership",
          "status": "pending"
        },
        {
          "dimension": "mathematical-correctness",
          "status": "pending"
        },
        {
          "dimension": "capability-observability",
          "status": "pending"
        },
        {
          "dimension": "representation-coverage",
          "status": "pending"
        },
        {
          "dimension": "dependency-state-honesty",
          "status": "pending"
        }
      ],
      "overall_status": "pending",
      "territory_id": "ola:n:8994155f-ccce-4906-a6d5-8fba0d4bcf41",
      "territory_revision": 1
    },
    {
      "decisions": [
        {
          "dimension": "scope-boundary",
          "status": "pending"
        },
        {
          "dimension": "material-omissions",
          "status": "pending"
        },
        {
          "dimension": "aggregation-split-quality",
          "status": "pending"
        },
        {
          "dimension": "multi-region-membership",
          "status": "pending"
        },
        {
          "dimension": "mathematical-correctness",
          "status": "pending"
        },
        {
          "dimension": "capability-observability",
          "status": "pending"
        },
        {
          "dimension": "representation-coverage",
          "status": "pending"
        },
        {
          "dimension": "dependency-state-honesty",
          "status": "pending"
        }
      ],
      "overall_status": "pending",
      "territory_id": "ola:n:75ad3a83-f3b6-4924-a2d5-86d6ca73f1fd",
      "territory_revision": 1
    },
    {
      "decisions": [
        {
          "dimension": "scope-boundary",
          "status": "pending"
        },
        {
          "dimension": "material-omissions",
          "status": "pending"
        },
        {
          "dimension": "aggregation-split-quality",
          "status": "pending"
        },
        {
          "dimension": "multi-region-membership",
          "status": "pending"
        },
        {
          "dimension": "mathematical-correctness",
          "status": "pending"
        },
        {
          "dimension": "capability-observability",
          "status": "pending"
        },
        {
          "dimension": "representation-coverage",
          "status": "pending"
        },
        {
          "dimension": "dependency-state-honesty",
          "status": "pending"
        }
      ],
      "overall_status": "pending",
      "territory_id": "ola:n:b8882f8f-c6b6-46ba-a7f5-b93c326d7ca6",
      "territory_revision": 1
    },
    {
      "decisions": [
        {
          "dimension": "scope-boundary",
          "status": "pending"
        },
        {
          "dimension": "material-omissions",
          "status": "pending"
        },
        {
          "dimension": "aggregation-split-quality",
          "status": "pending"
        },
        {
          "dimension": "multi-region-membership",
          "status": "pending"
        },
        {
          "dimension": "mathematical-correctness",
          "status": "pending"
        },
        {
          "dimension": "capability-observability",
          "status": "pending"
        },
        {
          "dimension": "representation-coverage",
          "status": "pending"
        },
        {
          "dimension": "dependency-state-honesty",
          "status": "pending"
        }
      ],
      "overall_status": "pending",
      "territory_id": "ola:n:77411999-33ee-403c-b09e-f79165832eca",
      "territory_revision": 1
    },
    {
      "decisions": [
        {
          "dimension": "scope-boundary",
          "status": "pending"
        },
        {
          "dimension": "material-omissions",
          "status": "pending"
        },
        {
          "dimension": "aggregation-split-quality",
          "status": "pending"
        },
        {
          "dimension": "multi-region-membership",
          "status": "pending"
        },
        {
          "dimension": "mathematical-correctness",
          "status": "pending"
        },
        {
          "dimension": "capability-observability",
          "status": "pending"
        },
        {
          "dimension": "representation-coverage",
          "status": "pending"
        },
        {
          "dimension": "dependency-state-honesty",
          "status": "pending"
        }
      ],
      "overall_status": "pending",
      "territory_id": "ola:n:194a3600-e568-42b6-a4c4-e635a6775cef",
      "territory_revision": 1
    },
    {
      "decisions": [
        {
          "dimension": "scope-boundary",
          "status": "pending"
        },
        {
          "dimension": "material-omissions",
          "status": "pending"
        },
        {
          "dimension": "aggregation-split-quality",
          "status": "pending"
        },
        {
          "dimension": "multi-region-membership",
          "status": "pending"
        },
        {
          "dimension": "mathematical-correctness",
          "status": "pending"
        },
        {
          "dimension": "capability-observability",
          "status": "pending"
        },
        {
          "dimension": "representation-coverage",
          "status": "pending"
        },
        {
          "dimension": "dependency-state-honesty",
          "status": "pending"
        }
      ],
      "overall_status": "pending",
      "territory_id": "ola:n:2b5a234b-0ef4-47fa-900b-4188758d604e",
      "territory_revision": 1
    },
    {
      "decisions": [
        {
          "dimension": "scope-boundary",
          "status": "pending"
        },
        {
          "dimension": "material-omissions",
          "status": "pending"
        },
        {
          "dimension": "aggregation-split-quality",
          "status": "pending"
        },
        {
          "dimension": "multi-region-membership",
          "status": "pending"
        },
        {
          "dimension": "mathematical-correctness",
          "status": "pending"
        },
        {
          "dimension": "capability-observability",
          "status": "pending"
        },
        {
          "dimension": "representation-coverage",
          "status": "pending"
        },
        {
          "dimension": "dependency-state-honesty",
          "status": "pending"
        }
      ],
      "overall_status": "pending",
      "territory_id": "ola:n:51cb46fd-37cc-4fc4-9148-33fb10aa4588",
      "territory_revision": 1
    },
    {
      "decisions": [
        {
          "dimension": "scope-boundary",
          "status": "pending"
        },
        {
          "dimension": "material-omissions",
          "status": "pending"
        },
        {
          "dimension": "aggregation-split-quality",
          "status": "pending"
        },
        {
          "dimension": "multi-region-membership",
          "status": "pending"
        },
        {
          "dimension": "mathematical-correctness",
          "status": "pending"
        },
        {
          "dimension": "capability-observability",
          "status": "pending"
        },
        {
          "dimension": "representation-coverage",
          "status": "pending"
        },
        {
          "dimension": "dependency-state-honesty",
          "status": "pending"
        }
      ],
      "overall_status": "pending",
      "territory_id": "ola:n:ef99a75d-00c3-4991-a0b9-1299d7bcfdd1",
      "territory_revision": 1
    },
    {
      "decisions": [
        {
          "dimension": "scope-boundary",
          "status": "pending"
        },
        {
          "dimension": "material-omissions",
          "status": "pending"
        },
        {
          "dimension": "aggregation-split-quality",
          "status": "pending"
        },
        {
          "dimension": "multi-region-membership",
          "status": "pending"
        },
        {
          "dimension": "mathematical-correctness",
          "status": "pending"
        },
        {
          "dimension": "capability-observability",
          "status": "pending"
        },
        {
          "dimension": "representation-coverage",
          "status": "pending"
        },
        {
          "dimension": "dependency-state-honesty",
          "status": "pending"
        }
      ],
      "overall_status": "pending",
      "territory_id": "ola:n:10838764-47a9-4c87-8f05-747f1dc05d22",
      "territory_revision": 1
    },
    {
      "decisions": [
        {
          "dimension": "scope-boundary",
          "status": "pending"
        },
        {
          "dimension": "material-omissions",
          "status": "pending"
        },
        {